[
  {
    "id": "autorize",
    "name": "Autorize",
    "license": "MIT",
    "description": "Automated access control testing plugin for Caido",
    "author": {
      "name": "Caido Labs Inc.",
      "email": "dev@caido.io",
      "url": "https://github.com/caido-community/autorize"
    },
    "repository": "caido-community/authorize"
  }
]
